<?xml version="1.0" encoding="UTF-8"?>
<scientific-paper xmlns="http://www.ftn.uns.ac.rs/scientific-paper"
    xmlns:xsi="http://www.w3.org/2001/XMLSchema-instance"
    xsi:schemaLocation="http://www.ftn.uns.ac.rs ../Schemas/scientific-paper.xsd"
    received="2006-05-04" revised="2006-05-04" accepted="2006-05-04" id="1">
    <header>
        <title>title0</title>
        <authors>
            <author>
                <first-name>first-name0</first-name>
                <middle-name>middle-name0</middle-name>
                <last-name>last-name0</last-name>
                <institution>
                    <name>name0</name>
                    <location>
                        <city>city0</city>
                        <country>country0</country>
                    </location>
                </institution>
            </author>
            <author>
                <first-name>first-name1</first-name>
                <middle-name>middle-name1</middle-name>
                <last-name>last-name1</last-name>
                <institution>
                    <name>name1</name>
                    <location>
                        <city>city1</city>
                        <country>country1</country>
                    </location>
                </institution>
            </author>
        </authors>
    </header>
    <abstract>
        <keywords>keywords0</keywords>
        <purpose>
            <quote>quote0</quote>
            <underline>underline0</underline>
        </purpose>
        <paper-type>paper-type0</paper-type>
    </abstract>
    <sections>
        <section heading="heading1">
            <paragraph>
                <italic>italic0</italic>
                <bold>bold0</bold>
            </paragraph>
            <paragraph>
                <bold>bold1</bold>
                <quote>quote1</quote>
            </paragraph>
        </section>
        <section heading="heading3">
            <paragraph>
                <italic>italic1</italic>
                <bold>bold2</bold>
            </paragraph>
            <paragraph>
                <underline>underline1</underline>
                <underline>underline2</underline>
            </paragraph>
        </section>
    </sections>
    <references>
        <reference>
            <authors>
                <author>
                    <first-name>first-name2</first-name>
                    <middle-name>middle-name2</middle-name>
                    <last-name>last-name2</last-name>
                </author>
                <author>
                    <first-name>first-name3</first-name>
                    <middle-name>middle-name3</middle-name>
                    <last-name>last-name3</last-name>
                </author>
            </authors>
            <year>50</year>
            <paper-name>paper-name0</paper-name>
            <journal>journal0</journal>
        </reference>
    </references>
</scientific-paper>
