<?xml version="1.0" encoding="UTF-8"?>
<sp:scientific-paper xmlns:cmn="http://www.ftn.uns.ac.rs/common"
                     xmlns:jxb="http://java.sun.com/xml/ns/jaxb"
                     xmlns:sp="http://www.ftn.uns.ac.rs/scientific-publication"
                     xmlns:xsi="http://www.w3.org/2001/XMLSchema-instance"
                     xsi:schemaLocation="http://www.ftn.uns.ac.rs/scientific-publication file:/C:/Users/bojan/Desktop/SIIT/VII_semestar/XML-Projekat/ScientificPublications/Schemas/scientific-paper.xsd">
    <sp:header>
        <sp:title>ELEKTRO</sp:title>
        <sp:authors>
            <cmn:author>
                <cmn:first-name>first-name1</cmn:first-name>
                <cmn:last-name>last-name1</cmn:last-name>
                <cmn:email>autor2@gmail.com</cmn:email>
                <cmn:institution>
                    <cmn:name>Faculty</cmn:name>
                    <cmn:location>
                        <cmn:city>City</cmn:city>
                        <cmn:country>Country</cmn:country>
                    </cmn:location>
                </cmn:institution>
            </cmn:author>
        </sp:authors>
    </sp:header>
    <sp:abstract>
        <sp:keywords>c, c++</sp:keywords>
        <sp:paper-type>type</sp:paper-type>
        <sp:purpose>
            blablabla
            <cmn:bold>blablalba</cmn:bold>
            <cmn:italic>blablalba</cmn:italic>
            blabla
        </sp:purpose>
    </sp:abstract>
    <sp:sections>
        <cmn:section>
            <cmn:header>header0</cmn:header>
            <cmn:paragraphs>
                <cmn:paragraph>
                    blablabla
                    <cmn:bold>blablalba</cmn:bold>
                    <cmn:italic>blablalba</cmn:italic>
                    blabla
                </cmn:paragraph>
            </cmn:paragraphs>
        </cmn:section>
    </sp:sections>
    <sp:references>
        <sp:reference>
            <sp:authors>
                <cmn:author>
                    <cmn:first-name>first-name1</cmn:first-name>
                    <cmn:last-name>last-name1</cmn:last-name>
                </cmn:author>
            </sp:authors>
            <sp:year>50</sp:year>
            <sp:paper-name>paper-name0</sp:paper-name>
        </sp:reference>
    </sp:references>
</sp:scientific-paper>
