<?xml version="1.0" encoding="UTF-8"?>
<sp:scientific-paper xmlns:sp="http://www.ftn.uns.ac.rs/scientific-publication"
 xmlns:jxb="http://java.sun.com/xml/ns/jaxb"
 xmlns:xsi="http://www.w3.org/2001/XMLSchema-instance"
 xsi:schemaLocation="http://www.ftn.uns.ac.rs/scientific-publication file:/C:/Users/bojan/Desktop/SIIT/VII_semestar/XML-Projekat/ScientificPublications/Schemas/scientific-paper.xsd">
    <sp:header>
        <sp:title>title0</sp:title>
        <sp:authors>
            <sp:author>
                <sp:first-name>first-name0</sp:first-name>
                <sp:last-name>last-name0</sp:last-name>
            </sp:author>
        </sp:authors>
    </sp:header>
    <sp:abstract>
        <sp:keywords>keywords0</sp:keywords>
        <sp:purpose>
        </sp:purpose>
    </sp:abstract>
    <sp:sections>
        <sp:section>
            <sp:paragraph>
            </sp:paragraph>
        </sp:section>
    </sp:sections>
    <sp:references>
        <sp:reference>
            <sp:authors>
                <sp:author>
                    <sp:first-name>first-name1</sp:first-name>
                    <sp:last-name>last-name1</sp:last-name>
                </sp:author>
            </sp:authors>
            <sp:year>50</sp:year>
            <sp:paper-name>paper-name0</sp:paper-name>
        </sp:reference>
    </sp:references>
</sp:scientific-paper>
